{
  "project_name": "2026_ai_support",
  "created_at": "2026-07-03",
  "notice": {
    "title": "2026년 혁신 소상공인 AI 활용지원 사업 참여 소상공인 모집공고",
    "agency": "중소벤처기업부, 소상공인시장진흥공단",
    "purpose": "인력·자금 등이 부족한 소상공인에게 AI 도입·활용을 지원하여 경영 효율화 및 제품·서비스 혁신을 통한 생산성 향상 도모",
    "raw_text": "# 2026년 혁신 소상공인 AI 활용지원 사업 - Claude Code 입력용 핵심 정리\n\n> 원본: `1_2026년 혁신 소상공인 AI 활용지원 사업 참여 소상공인 모집공고(수정).hwp`\n> 용도: Claude Code / hyemi-ai-factory / 정부지원사업 공장 앱에 넣기 위한 Markdown 입력본\n> 주의: 원문 전체가 아니라 실전 분석에 필요한 핵심 공고 정보 정리본입니다. 세부 문구 확인이 필요한 경우 원본 HWP를 별도 확인해야 합니다.\n\n---\n\n## 1. 공고 기본정보\n\n- 공고명: 2026년 혁신 소상공인 AI 활용지원 사업 참여 소상공인 모집공고\n- 공고일: 2026년 6월 12일\n- 주관: 중소벤처기업부, 소상공인시장진흥공단\n- 신청기간: 2026년 6월 12일(금) ~ 2026년 7월 3일(금) 16:00까지\n- 신청방법: 소상공인24 홈페이지 접수\n- 사업기간: 협약 체결일로부터 2026년 12월 31일까지\n- 지원대상: 「소상공인기본법」 제2조에 따른 소상공인으로 신청일 현재 정상적으로 영업 중인 소상공인\n\n---\n\n## 2. 사업 목적\n\n인력·자금 등이 부족한 소상공인에게 AI 도입·활용을 지원하여 경영 효율화 및 제품·서비스 혁신을 통한 생산성 향상을 도모한다.\n\n---\n\n## 3. 지원 내용\n\n### STEP1. AI 활용모델 구축\n\n- 선정규모: 소상공인 1,000개사\n- 지원내용: AI 역량 진단, 원포인트 컨설팅, 프롬프트 최적화, AI 로드맵 수립, 사업모델 개선방향 도출, AI 활용모델 설계·테스트 등\n- 전문 AI 멘토기업을 통해 사업모델 구체화 및 고도화 지원\n\n### STEP2. AI 비즈니스 모델 구현\n\n- 선정규모: 약 680개사\n- 지원내용: 사업장 내 AI 시스템 구축, AI 활용 상용 시제품 개발, 타겟 마케팅, 공정 최적화 등 실제 비즈니스 적용\n- 사업화자금: 최대 4천만원 범위 내 차등지원\n- 정부지원금: 총 사업비의 80% 이하\n- 자부담금: 총 사업비의 20% 이상\n\n---\n\n## 4. 사업비 구조\n\n| 구분 | 총사업비 | 정부지원금 | 자부담금 |\n|---|---:|---:|---:|\n| 비율 | 100% | 80% 이하 | 20% 이상 |\n| 예시 1 | 40,000,000원 | 32,000,000원 | 8,000,000원 |\n| 예시 2 | 25,000,000원 | 20,000,000원 | 5,000,000원 |\n| 예시 3 | 19,000,000원 | 15,200,000원 | 3,800,000원 |\n\n---\n\n## 5. 사업화자금 집행 가능 항목\n\n### 정부지원금 집행항목\n\n1. 제품·서비스 고도화\n   - AI 활용 신제품 개발\n   - 제품/서비스 고도화 용역비\n   - AI 활용 시제품 제작 비용\n   - 테스트 운영 비용\n\n2. AI 활용 도입\n   - AI 솔루션 신규 도입\n   - 기능 확장\n   - 시스템 연계 비용 등\n\n3. 홍보비\n   - AI 콘텐츠 활용 광고비\n   - 마케팅 집행비\n\n4. 전문가활용비\n   - 외부 전문가 및 전문기관 자문 지급수수료\n\n5. 재료구입비\n   - AI 활용 신제품 개발, 제품/서비스 고도화를 위한 재료 구입비\n\n6. 수수료 및 사용료\n   - 산업재산권 취득비\n   - 각종 수수료 및 사용료\n\n7. 임차료\n   - 사업 수행을 위한 기기·장비 임차비\n\n### 자부담금 인정항목\n\n1. 인건비\n   - 소상공인 본인 직접 참여 인건비\n   - 상시·지속적 업무 종사 근로자 보수\n\n2. 수수료 및 사용료\n   - 지급보증보험증권 수수료\n\n3. 임차비\n   - 사업장 역할·기능을 하는 임차비, 월세 등\n\n---\n\n## 6. 사업비 집행 유의사항\n\n- 사업비는 e-나라도움 시스템을 통해 집행한다.\n- 부가가치세 10%는 사업비로 집행할 수 없다.\n- 모든 지출 증빙은 카드매출전표 또는 세금계산서를 원칙으로 한다.\n- 주관기관이 추가 서류를 요청할 수 있다.\n- 민법 제767조상 친족관계에 있는 자에게 사업비를 집행할 수 없다.\n- 대표자가 현재 재직 중이거나 사업 참여 전 재직했던 기업과 외주 용역거래가 불가하다.\n- 사업화자금은 사업비 집행계획에 따라 집행해야 하며 목적 외 사용이 불가하다.\n\n---\n\n## 7. 신청자격\n\n- 「소상공인기본법」 제2조에 따른 소상공인\n- 신청일 현재 정상적으로 영업 중인 소상공인\n- 공동대표 사업체는 주대표 1인만 신청 가능\n- 발표평가 시 주대표자 참석 필수, 공동대표 대참 불가\n\n---\n\n## 8. 신청제외 대상\n\n다음에 해당하면 신청 제외 또는 탈락/선정취소 위험이 있다.\n\n1. 소상공인 정책자금 지원제외 업종 영위\n2. 금융기관 채무불이행, 부도, 화의, 법정관리 등 정상 금융거래 곤란\n3. 국세 또는 지방세 체납으로 규제 중\n4. 정부지원사업 참여 제한 등 제재 조치 중\n5. 신청일 현재 사업자등록이 없거나 휴·폐업 중\n6. 고용노동부 공개 체불사업주 명단 포함\n7. 비영리 개인사업자·법인·단체·조합\n8. 기타 중소벤처기업부 장관이 참여제한 사유가 있다고 인정하는 경우\n\n---\n\n## 9. 제출서류\n\n### 필수\n\n1. 사업신청서 - 소상공인24 홈페이지 작성\n2. 사업계획서 - 서식 작성 후 첨부\n3. 중소기업확인서 또는 소상공인확인서\n4. 사업자등록증\n5. 국세 납세증명서\n6. 지방세 납세증명서\n7. 부가가치과세표준증명 최근 3개년: 2023년, 2024년, 2025년\n\n### 해당 시\n\n8. 공동대표 관련 서류\n   - 사업자등록증명원 공동대표 명시\n   - 공동대표 확인서\n9. 가점 증빙서류\n\n---\n\n## 10. 제출서류 유의사항\n\n- 제출서류는 신청접수 기간 또는 보완기간 내 유효한 경우 인정된다.\n- 항목당 최대 30MB까지 허용된다.\n- 항목당 파일이 여러 개면 zip파일로 업로드해야 한다.\n- 공공마이데이터 제공요구 시 일부 서류는 제출 생략 가능하나, 신고·발급 이력이 없으면 보완 요청이 있을 수 있다.\n- 공공마이데이터 제공요구를 하지 않으면 직접 발급 및 첨부해야 한다.\n- 필요시 서류보완 요청 가능하다.\n\n---\n\n## 11. 선정절차\n\n1. 요건검토\n   - 소상공인 여부\n   - 서류 제출 여부\n   - 지원제외 대상 해당 여부\n   - 사업자등록 상태\n   - 국세·지방세 체납 등\n\n2. 서류평가\n   - STEP1 AI 활용모델 구축 지원 대상자 1,000개사 선정\n\n3. 실전모델 설계\n   - 전문 AI 멘토기업 매칭\n   - AI 활용 진단\n   - 사업모델 개선방향 도출\n   - 테스트 등\n\n4. 발표평가\n   - STEP2 AI 비즈니스 모델 구현 소상공인 약 680개사 선정\n   - 사업화자금 최대 4천만원 지원\n\n---\n\n## 12. 서류평가 항목\n\n| 평가항목 | 세부내용 | 배점 |\n|---|---|---:|\n| AI활용 적합성 | AI 활용 전략의 명확성 및 도입 필요성 | 15 |\n| AI활용 적합성 | 사업 운영 프로세스 내 AI 적용 가능성 및 적합성 | 15 |\n| 성장가능성 | AI 적용을 통한 사업모델 개선 가능성 | 20 |\n| 성장가능성 | 시장성·경쟁력 및 지속 성장 가능성 | 20 |\n| 참여역량 | 사업참여 의지 및 수행역량 | 15 |\n| 참여역량 | 사업계획의 구체성 및 실행가능성 | 15 |\n| 합계 | 가점 별도 | 100 |\n\n---\n\n## 13. 발표평가 관련\n\n- STEP1 실전모델 설계 결과를 바탕으로 발표평가 진행\n- 평가 관점: AI 활용모델의 완성도, 사업고도화 가능성, 실행·사업화 역량 등\n- 국내 사업환경 적용 적합성, 보안성, 운영안정성 등을 구체적으로 제시하면 평가 시 우대 가능\n- 발표평가 시 주대표자 참석 필수\n\n---\n\n## 14. 일정\n\n| 추진단계 | 일정 |\n|---|---|\n| 신청·접수 | ~ 2026년 7월 3일 |\n| 서류평가 | 2026년 7월 중 |\n| 평가결과 통보 | 2026년 7월 중 |\n| STEP1 AI 활용모델 구축 지원 | 2026년 7~8월 |\n| 발표평가 | 2026년 9월 |\n| STEP2 AI 비즈니스 모델 구현 | 2026년 10~12월 |\n| 전국 AI 비즈니스 경진대회 | 2026년 12월 |\n\n---\n\n## 15. 동시수행 제한 사업\n\n중소벤처기업부 산하기관 또는 타부처 정부지원사업 중 공고의 참고6에 해당하는 사업은 동시에 수행 불가하다.\n\n주요 예시:\n- 로컬창업 육성사업\n- 로컬기업 육성\n- 강한소상공인 성장지원\n- 글로벌 소상공인 육성\n- 혁신 소상공인 립스프로그램\n- 소상공인 생활문화 혁신지원\n- 예비창업패키지\n- 초기창업패키지\n- 창업도약패키지\n- 초격차 스타트업 프로젝트\n- 창업중심대학\n- 재도전성공패키지\n- 관광벤처사업 공모전 등\n\n실제 신청 전 신청자의 현재 수행 사업과 반드시 대조해야 한다.\n\n---\n\n## 16. 공장 분석 시 반드시 잡아야 할 위험\n\n1. 실제 공고 원문 없이 아이디어 LOCK 금지\n2. 신청자격 미확인 시 LOCK 금지\n3. 지원제외 업종 확인 필요\n4. 국세·지방세 체납 여부 확인 필요\n5. 중복수혜/동시수행 제한 사업 확인 필요\n6. 부가세 사업비 포함 금지\n7. 친족에게 사업비 집행 금지\n8. 단순 AI 솔루션 구매·구독만으로는 지원취지 부적합\n9. AI 도입 필요성, 운영 프로세스 내 적용성, 성장가능성, 실행가능성을 모두 반영해야 함\n10. 개인정보·보안성·운영안정성 방어 필요\n11. 실제 사업장 적용 가능성과 실증 계획 필요\n12. 예산은 집행항목과 산출물이 연결되어야 함\n13. 발표평가 대비 필요\n\n---\n\n## 17. 이번 공고에 맞는 아이템 방향\n\n적합한 방향:\n- 소상공인 운영 프로세스 내 AI 적용\n- 주문관리, 예약관리, 고객응대, 재고관리, 문서작성, 마케팅, 공정 최적화 등 현장 업무 개선\n- AI 활용모델이 실제 사업장에 적용되는 구조\n- 단순 콘텐츠 제작이 아니라 비즈니스 모델 구현과 생산성 향상으로 이어지는 구조\n- 대표자 검수형, 보안·운영안정성 포함\n\n위험한 방향:\n- 단순 ChatGPT 구독\n- 단순 외주 앱 개발\n- 근거 없는 완전 자동화\n- 실측 없는 시간 절감 수치\n- 기존 제품 구매 중심\n- AI 적용 지점이 불명확한 아이템\n- 예산이 산출물과 연결되지 않는 계획\n\n---\n\n## 18. Hyemi Factory에 넣을 분석 지시\n\n이 공고를 기준으로 실제 신청자 정보를 받아 다음을 수행해야 한다.\n\n1. 신청자격 체크\n2. 지원제외 위험 체크\n3. 제출서류 체크리스트 생성\n4. 중복수혜 위험 체크\n5. 서류평가 100점 기준 분석\n6. 아이디어 후보별 적합성 평가\n7. 최종 아이디어 LOCK 여부 판단\n8. 예산 가능 항목/위험 항목 분리\n9. 위험 표현 검출\n10. 발표평가 예상 질문 생성\n11. revision_order 작성\n12. HANDOFF 작성\n\nLOCK 조건:\n- 공고 원문 확인 완료\n- 신청자격 확인 완료\n- 지원제외 위험 없음 또는 해소 가능\n- 평가항목 대응 가능\n- 예산 방향이 집행항목과 연결됨\n- 증빙자료 목록 확인됨\n- 위험 표현 제거됨\n\n",
    "apply_deadline": "2026-07-03(금) 16:00 (소상공인24)",
    "execution_period": "협약 체결일 ~ 2026-12-31 (STEP1 7~8월, 발표평가 9월, STEP2 10~12월)",
    "eligibility": "소상공인기본법 제2조 소상공인, 신청일 현재 정상 영업 중. 공동대표는 주대표 1인만 신청",
    "exclusions": "정책자금 지원제외 업종, 채무불이행·부도·법정관리, 국세·지방세 체납 규제 중, 참여제한 제재 중, 휴·폐업, 체불사업주 명단, 비영리, 동시수행 제한 사업(예비창업패키지·강한소상공인 등) [원문 업종표 확인 필요]",
    "budget": {
      "max_amount": "STEP2 사업화자금 최대 4,000만원 (정부지원 80% 이하)",
      "self_pay_ratio": "20% 이상",
      "allowed_items": [
        "제품·서비스 고도화(신제품 개발·용역·시제품·테스트)",
        "AI 솔루션 도입·기능 확장·시스템 연계",
        "홍보비(AI 콘텐츠 광고·마케팅)",
        "전문가활용비",
        "재료구입비",
        "수수료·사용료(산업재산권 포함)",
        "기기·장비 임차료"
      ],
      "excluded_items": [
        "부가가치세 10%",
        "친족(민법 767조) 거래",
        "대표자 현·전 재직 기업 외주 용역",
        "목적 외 사용"
      ]
    },
    "format": {
      "form_type": "사업계획서 서식 [원본 HWP 확인 필요]",
      "page_limit": "미확보",
      "char_limit": "미확보"
    },
    "scoring": [
      {
        "item": "AI활용 적합성 — 전략 명확성·도입 필요성",
        "points": 15
      },
      {
        "item": "AI활용 적합성 — 운영 프로세스 내 적용 가능성",
        "points": 15
      },
      {
        "item": "성장가능성 — 사업모델 개선 가능성",
        "points": 20
      },
      {
        "item": "성장가능성 — 시장성·경쟁력·지속 성장",
        "points": 20
      },
      {
        "item": "참여역량 — 참여 의지·수행역량",
        "points": 15
      },
      {
        "item": "참여역량 — 계획 구체성·실행가능성",
        "points": 15
      }
    ],
    "presentation": {
      "required": "있음 — STEP2 발표평가(9월), 주대표 참석 필수·대참 불가",
      "present_minutes": "미확보",
      "qna_minutes": "미확보"
    },
    "bonus_items": [
      "가점 별도 [원문 확인 필요]"
    ]
  },
  "applicant": {
    "name": "미확보",
    "biz_type": "미확보",
    "biz_years": "미확보",
    "industry": "미확보",
    "industry_code": "미확보",
    "channels": [],
    "duplicate_grant_history": "미확인",
    "tax_arrears": "미확인",
    "closed_biz_history": "미확인",
    "notes": ""
  },
  "ideas": [],
  "evidence": {
    "owned": [],
    "planned": []
  },
  "budget_plan": [],
  "selected_idea_id": null,
  "approvals": {
    "eligibility_confirmed": false,
    "idea_selected": false,
    "budget_confirmed": false,
    "final_submission_approved": false
  }
}